{
  "$schema": "https://json-schema.org/draft/2020-12/schema",
  "$id": "https://readium.org/speech/voices.schema.json",
  "title": "Recommended voices for TTS",
  "type": "object",
  "additionalProperties": false,
  "properties": {
    "language": {
      "type": "string"
    },
    "defaultRegion": {
      "type": "string"
    },
    "testUtterance": {
      "type": "string"
    },
    "voices": {
      "type": "array",
      "minItems": 1,
      "items": {
        "type": "object",
        "additionalProperties": false,
        "properties": {
          "label": {
            "type": "string",
            "description": "Provides a human-friendly label for each voice."
          },
          "name": {
            "type": "string",
            "description": "Identifies voices, as returned by the Web Speech API."
          },
          "localizedName": {
            "type": "string",
            "description": "Identifies the string pattern used to localized a given voice.",
            "enum": [
              "android",
              "apple"
            ]
          },
          "note": {
            "type": "string"
          },
          "altNames": {
            "type": "array",
            "items": {
              "type": "string",
              "description": "Alternate names for a given voice. Only useful for Apple voices."
            }
          },
          "nativeID": {
            "type": "array",
            "items": {
              "type": "string",
              "description": "Identifiers used by the native API of the platform for a specific voice."
            }
          },
          "language": {
            "type": "string",
            "description": "BCP-47 language tag that identifies the language of a voice."
          },
          "altLanguage": {
            "type": "string",
            "description": "Alternative BCP-47 language tag, mostly used for deprecated values."
          },
          "otherLanguages": {
            "type": "array",
            "items": {
              "type": "string"
            }
          },
          "multiLingual": {
            "type": "boolean",
            "description": "Identifies voices that are capable of handling multiple languages, even if it means that the voice itself will change. Only available on Microsoft Natural voices for now.",
            "default": false
          },
          "gender": {
            "type": "string",
            "description": "Identifies the gender of a voice.",
            "enum": [
              "neutral",
              "female",
              "male"
            ]
          },
          "children": {
            "type": "boolean",
            "description": "Indicates if the voice is a children voice.",
            "default": false
          },
          "quality": {
            "type": "array",
            "description": "Quality available for the variants of a given voice",
            "items": {
              "type": "string",
              "enum": [
                "veryLow",
                "low",
                "normal",
                "high",
                "veryHigh"
              ]
            }
          },
          "rate": {
            "type": "number",
            "description": "Default recommended speed rate for a voice.",
            "minimum": 0.1,
            "maximum": 10,
            "default": 1
          },
          "pitch": {
            "type": "number",
            "description": "Default recommended pitch rate for a voice.",
            "minimum": 0,
            "maximum": 2,
            "default": 1
          },
          "controls": {
            "type": "object",
            "description": "Indicates which controls are available for a given voice.",
            "additionalProperties": false,
            "properties": {
              "boundary": {
                "description": "Indicates whether a voice returns boundary events.",
                "type": "boolean",
                "default": true
              },
              "pitch": {
                "description": "Indicates whether a voice can be pitch adjusted.",
                "type": "boolean",
                "default": true
              }
            }
          },
          "os": {
            "type": "array",
            "description": "List of operating systems in which a voice is available.",
            "minItems": 1,
            "items": {
              "type": "string",
              "enum": [
                "Android",
                "ChromeOS",
                "iOS",
                "iPadOS",
                "macOS",
                "Windows"
              ]
            }
          },
          "browser": {
            "type": "array",
            "description": "List of Web browsers in which a voice is available.",
            "minItems": 1,
            "items": {
              "type": "string",
              "enum": [
                "ChromeDesktop",
                "Edge",
                "Firefox",
                "Safari"
              ]
            }
          },
          "preloaded": {
            "type": "boolean",
            "description": "Indicates that a voice is preloaded in all OS and browsers that have been identified.",
            "default": false
          }
        },
        "required": [
          "name"
        ]
      }
    }
  },
  "required": [
    "voices"
  ]
}