{
  "language": "ms",
  "defaultRegion": "ms-MY",
  "testUtterance": "Hello, nama saya {name} dan saya suara Melayu.",
  "voices": [
    {
      "label": "Yasmin",
      "name": "Microsoft Yasmin Online (Natural) - Malay (Malaysia)",
      "language": "ms-MY",
      "gender": "female",
      "quality": [
        "veryHigh"
      ],
      "rate": 1,
      "browser": [
        "Edge"
      ],
      "preloaded": true,
      "controls": {
        "pitch": false,
        "boundary": false
      }
    },
    {
      "label": "Osman",
      "name": "Microsoft Osman Online (Natural) - Malay (Malaysia)",
      "language": "ms-MY",
      "gender": "male",
      "quality": [
        "veryHigh"
      ],
      "rate": 1,
      "browser": [
        "Edge"
      ],
      "preloaded": true,
      "controls": {
        "pitch": false,
        "boundary": false
      }
    },
    {
      "label": "Amira",
      "name": "Amira",
      "localizedName": "apple",
      "language": "ms-MY",
      "gender": "female",
      "quality": [
        "low",
        "normal"
      ],
      "rate": 1,
      "pitch": 1,
      "os": [
        "macOS",
        "iOS",
        "iPadOS"
      ],
      "preloaded": true
    },
    {
      "label": "Rizwan",
      "name": "Microsoft Rizwan - Malay (Malaysia)",
      "language": "ms-MY",
      "gender": "male",
      "quality": [
        "normal"
      ],
      "rate": 1,
      "pitch": 1,
      "os": [
        "Windows"
      ],
      "preloaded": true
    },
    {
      "label": "Suara perempuan 1",
      "name": "Android Speech Recognition and Synthesis from Google ms-my-x-msc-network",
      "altNames": [
        "Android Speech Recognition and Synthesis from Google ms-my-x-msc-local",
        "Android Speech Recognition and Synthesis from Google ms-MY-language"
      ],
      "nativeID": [
        "ms-my-x-msc-network",
        "ms-my-x-msc-local"
      ],
      "language": "ms-MY",
      "gender": "female",
      "quality": [
        "high"
      ],
      "rate": 1,
      "pitch": 1,
      "os": [
        "Android",
        "ChromeOS"
      ],
      "preloaded": true
    },
    {
      "label": "Suara perempuan 2",
      "name": "Android Speech Recognition and Synthesis from Google ms-my-x-mse-network",
      "altNames": [
        "Android Speech Recognition and Synthesis from Google ms-my-x-mse-local"
      ],
      "nativeID": [
        "ms-my-x-mse-network",
        "ms-my-x-mse-local"
      ],
      "language": "ms-MY",
      "gender": "female",
      "quality": [
        "high"
      ],
      "rate": 1,
      "pitch": 1,
      "os": [
        "Android",
        "ChromeOS"
      ],
      "preloaded": true
    },
    {
      "label": "Suara lelaki 1",
      "name": "Android Speech Recognition and Synthesis from Google ms-my-x-msd-network",
      "altNames": [
        "Android Speech Recognition and Synthesis from Google ms-my-x-msd-local"
      ],
      "nativeID": [
        "ms-my-x-msd-network",
        "ms-my-x-msd-local"
      ],
      "language": "ms-MY",
      "gender": "male",
      "quality": [
        "high"
      ],
      "rate": 1,
      "pitch": 1,
      "os": [
        "Android",
        "ChromeOS"
      ],
      "preloaded": true
    },
    {
      "label": "Suara lelaki 2",
      "name": "Android Speech Recognition and Synthesis from Google ms-my-x-msg-network",
      "altNames": [
        "Android Speech Recognition and Synthesis from Google ms-my-x-msg-local"
      ],
      "nativeID": [
        "ms-my-x-msg-network",
        "ms-my-x-msg-local"
      ],
      "language": "ms-MY",
      "gender": "male",
      "quality": [
        "high"
      ],
      "rate": 1,
      "pitch": 1,
      "os": [
        "Android",
        "ChromeOS"
      ],
      "preloaded": true
    }
  ]
}
