{
  "language": "nl",
  "defaultRegion": "nl-NL",
  "testUtterance": "Hallo, mijn naam is {name} en ik ben een Nederlandse stem.",
  "voices": [
    {
      "label": "Colette",
      "name": "Microsoft Colette Online (Natural) - Dutch (Netherlands)",
      "language": "nl-NL",
      "gender": "female",
      "quality": [
        "veryHigh"
      ],
      "rate": 1,
      "browser": [
        "Edge"
      ],
      "preloaded": true,
      "controls": {
        "pitch": false
      }
    },
    {
      "label": "Fenna",
      "name": "Microsoft Fenna Online (Natural) - Dutch (Netherlands)",
      "language": "nl-NL",
      "gender": "female",
      "quality": [
        "veryHigh"
      ],
      "rate": 1,
      "browser": [
        "Edge"
      ],
      "preloaded": true,
      "controls": {
        "pitch": false
      }
    },
    {
      "label": "Hanna",
      "name": "Microsoft Hanna Online - Dutch (Netherlands)",
      "language": "nl-NL",
      "gender": "female",
      "quality": [
        "veryHigh"
      ],
      "rate": 1,
      "browser": [
        "Edge"
      ],
      "preloaded": true,
      "controls": {
        "pitch": false
      }
    },
    {
      "label": "Maarten",
      "name": "Microsoft Maarten Online (Natural) - Dutch (Netherlands)",
      "language": "nl-NL",
      "gender": "male",
      "quality": [
        "veryHigh"
      ],
      "rate": 1,
      "browser": [
        "Edge"
      ],
      "preloaded": true,
      "controls": {
        "pitch": false
      }
    },
    {
      "label": "Dena",
      "name": "Microsoft Dena Online (Natural) - Dutch (Belgium)",
      "language": "nl-BE",
      "gender": "female",
      "quality": [
        "veryHigh"
      ],
      "rate": 1,
      "browser": [
        "Edge"
      ],
      "preloaded": true,
      "controls": {
        "pitch": false
      }
    },
    {
      "label": "Arnaud",
      "name": "Microsoft Arnaud Online (Natural) - Dutch (Belgium)",
      "language": "nl-BE",
      "gender": "male",
      "quality": [
        "veryHigh"
      ],
      "rate": 1,
      "browser": [
        "Edge"
      ],
      "preloaded": true,
      "controls": {
        "pitch": false
      }
    },
    {
      "label": "Google mannelijke stem",
      "name": "Google Nederlands",
      "note": "This voice is pre-loaded in Chrome on desktop. Utterances that are longer than 14 seconds long can trigger a bug with this voice, check the notes in the project's README for more information.",
      "language": "nl-NL",
      "gender": "male",
      "quality": [
        "high"
      ],
      "rate": 1,
      "pitch": 1,
      "controls": {
        "boundary": false
      },
      "browser": [
        "ChromeDesktop"
      ],
      "preloaded": true
    },
    {
      "label": "Claire",
      "name": "Claire",
      "localizedName": "apple",
      "language": "nl-NL",
      "gender": "female",
      "quality": [
        "low",
        "normal"
      ],
      "rate": 1,
      "pitch": 1,
      "os": [
        "macOS",
        "iOS",
        "iPadOS"
      ]
    },
    {
      "label": "Xander",
      "name": "Xander",
      "localizedName": "apple",
      "language": "nl-NL",
      "gender": "male",
      "quality": [
        "low",
        "normal"
      ],
      "rate": 1,
      "pitch": 1,
      "os": [
        "macOS",
        "iOS",
        "iPadOS"
      ],
      "preloaded": true
    },
    {
      "label": "Ellen",
      "name": "Ellen",
      "localizedName": "apple",
      "language": "nl-BE",
      "gender": "female",
      "quality": [
        "low",
        "normal"
      ],
      "rate": 1,
      "pitch": 1,
      "os": [
        "macOS",
        "iOS",
        "iPadOS"
      ],
      "preloaded": true
    },
    {
      "label": "Frank",
      "name": "Microsoft Frank - Dutch (Netherlands)",
      "language": "nl-NL",
      "gender": "male",
      "quality": [
        "normal"
      ],
      "rate": 1,
      "pitch": 1,
      "os": [
        "Windows"
      ],
      "preloaded": true
    },
    {
      "label": "Vrouwelijke stem 1 (Nederland)",
      "name": "Google Nederlands 4 (Natural)",
      "altNames": [
        "Android Speech Recognition and Synthesis from Google nl-nl-x-lfc-network",
        "Chrome OS Nederlands 4",
        "Android Speech Recognition and Synthesis from Google nl-nl-x-lfc-local",
        "Android Speech Recognition and Synthesis from Google nl-NL-language"
      ],
      "nativeID": [
        "nl-nl-x-lfc-network",
        "nl-nl-x-lfc-local"
      ],
      "language": "nl-NL",
      "gender": "female",
      "quality": [
        "high"
      ],
      "rate": 1,
      "pitch": 1,
      "os": [
        "Android",
        "ChromeOS"
      ],
      "preloaded": true
    },
    {
      "label": "Vrouwelijke stem 2 (Nederland)",
      "name": "Google Nederlands 1 (Natural)",
      "altNames": [
        "Android Speech Recognition and Synthesis from Google nl-nl-x-tfb-network",
        "Chrome OS Nederlands 1",
        "Android Speech Recognition and Synthesis from Google nl-nl-x-tfb-local"
      ],
      "nativeID": [
        "nl-nl-x-tfb-network",
        "nl-nl-x-tfb-local"
      ],
      "language": "nl-NL",
      "gender": "female",
      "quality": [
        "high"
      ],
      "rate": 1,
      "pitch": 1,
      "os": [
        "Android",
        "ChromeOS"
      ],
      "preloaded": true
    },
    {
      "label": "Vrouwelijke stem 3 (Nederland)",
      "name": "Google Nederlands 5 (Natural)",
      "altNames": [
        "Android Speech Recognition and Synthesis from Google nl-nl-x-yfr-network",
        "Chrome OS Nederlands 5",
        "Android Speech Recognition and Synthesis from Google nl-nl-x-yfr-local"
      ],
      "nativeID": [
        "nl-nl-x-yfr-network",
        "nl-nl-x-yfr-local"
      ],
      "language": "nl-NL",
      "gender": "female",
      "quality": [
        "high"
      ],
      "rate": 1,
      "pitch": 1,
      "os": [
        "Android",
        "ChromeOS"
      ],
      "preloaded": true
    },
    {
      "label": "Mannelijke stem 1 (Nederland)",
      "name": "Google Nederlands 2 (Natural)",
      "altNames": [
        "Android Speech Recognition and Synthesis from Google nl-nl-x-bmh-network",
        "Chrome OS Nederlands 2",
        "Android Speech Recognition and Synthesis from Google nl-nl-x-bmh-local"
      ],
      "nativeID": [
        "nl-nl-x-bmh-network",
        "nl-nl-x-bmh-local"
      ],
      "language": "nl-NL",
      "gender": "male",
      "quality": [
        "high"
      ],
      "rate": 1,
      "pitch": 1,
      "os": [
        "Android",
        "ChromeOS"
      ],
      "preloaded": true
    },
    {
      "label": "Mannelijke stem 2 (Nederland)",
      "name": "Google Nederlands 3 (Natural)",
      "altNames": [
        "Android Speech Recognition and Synthesis from Google nl-nl-x-dma-network",
        "Chrome OS Nederlands 3",
        "Android Speech Recognition and Synthesis from Google nl-nl-x-dma-local"
      ],
      "nativeID": [
        "nl-nl-x-dma-network",
        "nl-nl-x-dma-local"
      ],
      "language": "nl-NL",
      "gender": "male",
      "quality": [
        "high"
      ],
      "rate": 1,
      "pitch": 1,
      "os": [
        "Android",
        "ChromeOS"
      ],
      "preloaded": true
    },
    {
      "label": "Vrouwelijke stem (België)",
      "name": "Android Speech Recognition and Synthesis from Google nl-be-x-bec-network",
      "altNames": [
        "Android Speech Recognition and Synthesis from Google nl-be-x-bec-local",
        "Android Speech Recognition and Synthesis from Google nl-BE-language"
      ],
      "nativeID": [
        "nl-be-x-bec-network",
        "nl-be-x-bec-local"
      ],
      "language": "nl-BE",
      "gender": "female",
      "quality": [
        "high"
      ],
      "rate": 1,
      "pitch": 1,
      "os": [
        "Android",
        "ChromeOS"
      ],
      "preloaded": true
    },
    {
      "label": "Mannelijke stem (België)",
      "name": "Android Speech Recognition and Synthesis from Google nl-be-x-bed-network",
      "altNames": [
        "Android Speech Recognition and Synthesis from Google nl-be-x-bed-local"
      ],
      "nativeID": [
        "nl-be-x-bed-network",
        "nl-be-x-bed-local"
      ],
      "language": "nl-BE",
      "gender": "male",
      "quality": [
        "high"
      ],
      "rate": 1,
      "pitch": 1,
      "os": [
        "Android",
        "ChromeOS"
      ],
      "preloaded": true
    }
  ]
}
