{
  "language": "nb",
  "defaultRegion": "nb-NO",
  "testUtterance": "Hei, jeg heter {name} og er en norsk stemme.",
  "voices": [
    {
      "label": "Pernille",
      "name": "Microsoft Pernille Online (Natural) - Norwegian (Bokmål, Norway)",
      "language": "nb-NO",
      "gender": "female",
      "quality": [
        "veryHigh"
      ],
      "rate": 1,
      "browser": [
        "Edge"
      ],
      "preloaded": true,
      "controls": {
        "pitch": false,
        "boundary": false
      }
    },
    {
      "label": "Finn",
      "name": "Microsoft Finn Online (Natural) - Norwegian (Bokmål Norway)",
      "language": "nb-NO",
      "gender": "male",
      "quality": [
        "veryHigh"
      ],
      "rate": 1,
      "browser": [
        "Edge"
      ],
      "preloaded": true,
      "controls": {
        "pitch": false,
        "boundary": false
      }
    },
    {
      "label": "Nora",
      "name": "Nora",
      "localizedName": "apple",
      "language": "nb-NO",
      "gender": "female",
      "quality": [
        "low",
        "normal"
      ],
      "rate": 1,
      "pitch": 1,
      "os": [
        "macOS",
        "iOS",
        "iPadOS"
      ],
      "preloaded": true
    },
    {
      "label": "Henrik",
      "name": "Henrik",
      "localizedName": "apple",
      "language": "nb-NO",
      "gender": "male",
      "quality": [
        "low",
        "normal"
      ],
      "rate": 1,
      "pitch": 1,
      "os": [
        "macOS",
        "iOS",
        "iPadOS"
      ]
    },
    {
      "label": "Jon",
      "name": "Microsoft Jon - Norwegian (Bokmål Norway)",
      "language": "nb-NO",
      "gender": "male",
      "quality": [
        "normal"
      ],
      "rate": 1,
      "pitch": 1,
      "os": [
        "Windows"
      ],
      "preloaded": true
    },
    {
      "label": "Kvinnestemme 1",
      "name": "Google Norsk Bokmål 2 (Natural)",
      "altNames": [
        "Android Speech Recognition and Synthesis from Google nb-no-x-cfl-network",
        "Chrome OS Norsk Bokmål 2",
        "Android Speech Recognition and Synthesis from Google nb-no-x-cfl-local",
        "Android Speech Recognition and Synthesis from Google nb-NO-language"
      ],
      "nativeID": [
        "nb-no-x-cfl-network",
        "nb-no-x-cfl-local"
      ],
      "language": "nb-NO",
      "gender": "female",
      "quality": [
        "high"
      ],
      "rate": 1,
      "pitch": 1,
      "os": [
        "Android",
        "ChromeOS"
      ],
      "preloaded": true,
      "controls": {
        "boundary": false
      }
    },
    {
      "label": "Kvinnestemme 2",
      "name": "Google Norsk Bokmål 1 (Natural)",
      "altNames": [
        "Android Speech Recognition and Synthesis from Google nb-no-x-rfj-network",
        "Chrome OS Norsk Bokmål 1",
        "Android Speech Recognition and Synthesis from Google nb-no-x-rfj-local"
      ],
      "nativeID": [
        "nb-no-x-rfj-network",
        "nb-no-x-rfj-local"
      ],
      "language": "nb-NO",
      "gender": "female",
      "quality": [
        "high"
      ],
      "rate": 1,
      "pitch": 1,
      "os": [
        "Android",
        "ChromeOS"
      ],
      "preloaded": true,
      "controls": {
        "boundary": false
      }
    },
    {
      "label": "Kvinnestemme 3",
      "name": "Google Norsk Bokmål 4 (Natural)",
      "altNames": [
        "Android Speech Recognition and Synthesis from Google nb-no-x-tfs-network",
        "Chrome OS Norsk Bokmål 4",
        "Android Speech Recognition and Synthesis from Google nb-no-x-tfs-local"
      ],
      "nativeID": [
        "nb-no-x-tfs-network",
        "nb-no-x-tfs-local"
      ],
      "language": "nb-NO",
      "gender": "female",
      "quality": [
        "high"
      ],
      "rate": 1,
      "pitch": 1,
      "os": [
        "Android",
        "ChromeOS"
      ],
      "preloaded": true,
      "controls": {
        "boundary": false
      }
    },
    {
      "label": "Mannsstemme 1",
      "name": "Google Norsk Bokmål 3 (Natural)",
      "altNames": [
        "Android Speech Recognition and Synthesis from Google nb-no-x-cmj-network",
        "Chrome OS Norsk Bokmål 3",
        "Android Speech Recognition and Synthesis from Google nb-no-x-cmj-local"
      ],
      "nativeID": [
        "nb-no-x-cmj-network",
        "nb-no-x-cmj-local"
      ],
      "language": "nb-NO",
      "gender": "male",
      "quality": [
        "high"
      ],
      "rate": 1,
      "pitch": 1,
      "os": [
        "Android",
        "ChromeOS"
      ],
      "preloaded": true,
      "controls": {
        "boundary": false
      }
    },
    {
      "label": "Mannsstemme 2",
      "name": "Google Norsk Bokmål 5 (Natural)",
      "altNames": [
        "Android Speech Recognition and Synthesis from Google nb-no-x-tmg-network",
        "Chrome OS Norsk Bokmål 5",
        "Android Speech Recognition and Synthesis from Google nb-no-x-tmg-local"
      ],
      "nativeID": [
        "nb-no-x-tmg-network",
        "nb-no-x-tmg-local"
      ],
      "language": "nb-NO",
      "gender": "male",
      "quality": [
        "high"
      ],
      "rate": 1,
      "pitch": 1,
      "os": [
        "Android",
        "ChromeOS"
      ],
      "preloaded": true,
      "controls": {
        "boundary": false
      }
    }
  ]
}
