{
  "language": "he",
  "defaultRegion": "he-IL",
  "testUtterance": "שלום, שמי {name} ואני קול עברי.",
  "voices": [
    {
      "label": "Hila",
      "name": "Microsoft Hila Online (Natural) - Hebrew (Israel)",
      "language": "he-IL",
      "altLanguage": "iw-IL",
      "gender": "female",
      "quality": [
        "veryHigh"
      ],
      "rate": 1,
      "browser": [
        "Edge"
      ],
      "preloaded": true,
      "controls": {
        "pitch": false
      }
    },
    {
      "label": "Avri",
      "name": "Microsoft Avri Online (Natural) - Hebrew (Israel)",
      "language": "he-IL",
      "altLanguage": "iw-IL",
      "gender": "male",
      "quality": [
        "veryHigh"
      ],
      "rate": 1,
      "browser": [
        "Edge"
      ],
      "preloaded": true,
      "controls": {
        "pitch": false
      }
    },
    {
      "label": "Carmit",
      "name": "Carmit",
      "localizedName": "apple",
      "language": "he-IL",
      "altLanguage": "iw-IL",
      "gender": "female",
      "quality": [
        "low",
        "normal"
      ],
      "rate": 1,
      "pitch": 1,
      "os": [
        "macOS",
        "iOS",
        "iPadOS"
      ],
      "preloaded": true
    },
    {
      "label": "Asaf",
      "name": "Microsoft Asaf - Hebrew (Israel)",
      "language": "he-IL",
      "altLanguage": "iw-IL",
      "gender": "male",
      "quality": [
        "normal"
      ],
      "rate": 1,
      "pitch": 1,
      "os": [
        "Windows"
      ],
      "preloaded": true
    },
    {
      "label": "קול גברי 1",
      "name": "Android Speech Recognition and Synthesis from Google he-il-x-heb-network",
      "altNames": [
        "Android Speech Recognition and Synthesis from Google he-il-x-heb-local",
        "Android Speech Recognition and Synthesis from Google he-IL-language"
      ],
      "nativeID": [
        "he-il-x-heb-network",
        "he-il-x-heb-local"
      ],
      "language": "he-IL",
      "altLanguage": "iw-IL",
      "gender": "male",
      "quality": [
        "high"
      ],
      "rate": 1,
      "pitch": 1,
      "os": [
        "Android",
        "ChromeOS"
      ],
      "preloaded": true
    },
    {
      "label": "קול נשי 1",
      "name": "Android Speech Recognition and Synthesis from Google he-il-x-hec-network",
      "altNames": [
        "Android Speech Recognition and Synthesis from Google he-il-x-hec-local"
      ],
      "nativeID": [
        "he-il-x-hec-network",
        "he-il-x-hec-local"
      ],
      "language": "he-IL",
      "altLanguage": "iw-IL",
      "gender": "female",
      "quality": [
        "high"
      ],
      "rate": 1,
      "pitch": 1,
      "os": [
        "Android",
        "ChromeOS"
      ],
      "preloaded": true
    },
    {
      "label": "קול גברי 2",
      "name": "Android Speech Recognition and Synthesis from Google he-il-x-hed-network",
      "altNames": [
        "Android Speech Recognition and Synthesis from Google he-il-x-hed-local"
      ],
      "nativeID": [
        "he-il-x-hed-network",
        "he-il-x-hed-local"
      ],
      "language": "he-IL",
      "altLanguage": "iw-IL",
      "gender": "male",
      "quality": [
        "high"
      ],
      "rate": 1,
      "pitch": 1,
      "os": [
        "Android",
        "ChromeOS"
      ],
      "preloaded": true
    },
    {
      "label": "קול נשי 2",
      "name": "Android Speech Recognition and Synthesis from Google he-il-x-hee-network",
      "altNames": [
        "Android Speech Recognition and Synthesis from Google he-il-x-hee-local"
      ],
      "nativeID": [
        "he-il-x-hee-network",
        "he-il-x-hee-local"
      ],
      "language": "he-IL",
      "altLanguage": "iw-IL",
      "gender": "female",
      "quality": [
        "high"
      ],
      "rate": 1,
      "pitch": 1,
      "os": [
        "Android",
        "ChromeOS"
      ],
      "preloaded": true
    }
  ]
}
