{
  "language": "uk",
  "defaultRegion": "uk-UA",
  "testUtterance": "Здравствуйте, меня зовут {name} и я украинский голос.",
  "voices": [
    {
      "label": "Polina",
      "name": "Microsoft Polina Online (Natural) - Ukrainian (Ukraine)",
      "language": "uk-UA",
      "gender": "female",
      "quality": [
        "veryHigh"
      ],
      "rate": 1,
      "browser": [
        "Edge"
      ],
      "preloaded": true,
      "controls": {
        "pitch": false,
        "boundary": false
      }
    },
    {
      "label": "Ostap",
      "name": "Microsoft Ostap Online (Natural) - Ukrainian (Ukraine)",
      "language": "uk-UA",
      "gender": "male",
      "quality": [
        "veryHigh"
      ],
      "rate": 1,
      "browser": [
        "Edge"
      ],
      "preloaded": true,
      "controls": {
        "pitch": false,
        "boundary": false
      }
    },
    {
      "label": "Lesya",
      "name": "Lesya",
      "localizedName": "apple",
      "language": "uk-UA",
      "gender": "female",
      "quality": [
        "low",
        "normal"
      ],
      "rate": 1,
      "pitch": 1,
      "os": [
        "macOS",
        "iOS",
        "iPadOS"
      ],
      "preloaded": true
    },
    {
      "label": "Жіночий голос",
      "name": "Google українська (Natural)",
      "altNames": [
        "Android Speech Recognition and Synthesis from Google uk-ua-x-hfd-network",
        "Chrome OS українська",
        "Android Speech Recognition and Synthesis from Google uk-ua-x-hfd-local",
        "Android Speech Recognition and Synthesis from Google uk-UA-language"
      ],
      "nativeID": [
        "uk-ua-x-hfd-network",
        "uk-ua-x-hfd-local"
      ],
      "language": "uk-UA",
      "gender": "female",
      "quality": [
        "high"
      ],
      "rate": 1,
      "pitch": 1,
      "os": [
        "Android",
        "ChromeOS"
      ],
      "preloaded": true
    }
  ]
}
