{
  "language": "ro",
  "defaultRegion": "ro-RO",
  "testUtterance": "Buna ziua, ma numesc {name} si sunt o voce romaneasca.",
  "voices": [
    {
      "label": "Alina",
      "name": "Microsoft Alina Online (Natural) - Romanian (Romania)",
      "language": "ro-RO",
      "gender": "female",
      "quality": [
        "veryHigh"
      ],
      "rate": 1,
      "browser": [
        "Edge"
      ],
      "preloaded": true,
      "controls": {
        "pitch": false
      }
    },
    {
      "label": "Emil",
      "name": "Microsoft Emil Online (Natural) - Romanian (Romania)",
      "language": "ro-RO",
      "gender": "male",
      "quality": [
        "veryHigh"
      ],
      "rate": 1,
      "browser": [
        "Edge"
      ],
      "preloaded": true,
      "controls": {
        "pitch": false
      }
    },
    {
      "label": "Ioana",
      "name": "Ioana",
      "localizedName": "apple",
      "language": "ro-RO",
      "gender": "female",
      "quality": [
        "low",
        "normal"
      ],
      "rate": 1,
      "pitch": 1,
      "os": [
        "macOS",
        "iOS",
        "iPadOS"
      ],
      "preloaded": true
    },
    {
      "label": "Andrei",
      "name": "Microsoft Andrei - Romanian (Romania)",
      "language": "ro-RO",
      "gender": "male",
      "quality": [
        "normal"
      ],
      "rate": 1,
      "pitch": 1,
      "os": [
        "Windows"
      ],
      "preloaded": true
    },
    {
      "label": "Voce feminină",
      "name": "Android Speech Recognition and Synthesis from Google ro-ro-x-vfv-network",
      "altNames": [
        "Android Speech Recognition and Synthesis from Google ro-ro-x-vfv-local",
        "Android Speech Recognition and Synthesis from Google ro-RO-language"
      ],
      "nativeID": [
        "ro-ro-x-vfv-network",
        "ro-ro-x-vfv-local"
      ],
      "language": "ro-RO",
      "gender": "female",
      "quality": [
        "high"
      ],
      "rate": 1,
      "pitch": 1,
      "os": [
        "Android",
        "ChromeOS"
      ],
      "preloaded": true
    }
  ]
}
