{
  "language": "yue",
  "defaultRegion": "yue-HK",
  "testUtterance": "你好，我叫 {name}，係越中文聲。",
  "voices": [
    {
      "label": "HiuGaai",
      "name": "Microsoft HiuGaai Online (Natural) - Chinese (Cantonese Traditional)",
      "language": "yue-HK",
      "altLanguage": "zh-HK",
      "gender": "female",
      "quality": [
        "veryHigh"
      ],
      "rate": 1,
      "browser": [
        "Edge"
      ],
      "preloaded": true,
      "controls": {
        "pitch": false,
        "boundary": false
      }
    },
    {
      "label": "HiuMaan",
      "name": "Microsoft HiuMaan Online (Natural) - Chinese (Hong Kong SAR)",
      "language": "yue-HK",
      "altLanguage": "zh-HK",
      "gender": "female",
      "quality": [
        "veryHigh"
      ],
      "rate": 1,
      "browser": [
        "Edge"
      ],
      "preloaded": true,
      "controls": {
        "pitch": false,
        "boundary": false
      }
    },
    {
      "label": "WanLung",
      "name": "Microsoft WanLung Online (Natural) - Chinese (Hong Kong SAR)",
      "language": "yue-HK",
      "altLanguage": "zh-HK",
      "gender": "male",
      "quality": [
        "veryHigh"
      ],
      "rate": 1,
      "browser": [
        "Edge"
      ],
      "preloaded": true,
      "controls": {
        "pitch": false,
        "boundary": false
      }
    },
    {
      "label": "Google 女聲",
      "name": "Google 粤語（香港）",
      "note": "This voice is pre-loaded in Chrome on desktop. Utterances that are longer than 14 seconds long can trigger a bug with this voice, check the notes in the project's README for more information.",
      "language": "yue-HK",
      "altLanguage": "zh-HK",
      "gender": "female",
      "quality": [
        "high"
      ],
      "rate": 1,
      "pitch": 1,
      "controls": {
        "boundary": false
      },
      "browser": [
        "ChromeDesktop"
      ],
      "preloaded": true
    },
    {
      "label": "Sinji",
      "name": "Sinji",
      "localizedName": "apple",
      "language": "yue-HK",
      "altLanguage": "zh-HK",
      "gender": "female",
      "quality": [
        "low",
        "normal",
        "high"
      ],
      "rate": 1,
      "pitch": 1,
      "os": [
        "macOS",
        "iOS",
        "iPadOS"
      ],
      "preloaded": true
    },
    {
      "label": "Aasing",
      "name": "Aasing",
      "localizedName": "apple",
      "language": "yue-HK",
      "altLanguage": "zh-HK",
      "gender": "male",
      "quality": [
        "normal"
      ],
      "rate": 1,
      "pitch": 1,
      "os": [
        "macOS",
        "iOS",
        "iPadOS"
      ],
      "preloaded": true
    },
    {
      "label": "Tracy",
      "name": "Microsoft Tracy - Chinese (Traditional, Hong Kong S.A.R.)",
      "language": "cmn-HK",
      "altLanguage": "zh-HK",
      "gender": "female",
      "quality": [
        "normal"
      ],
      "rate": 1,
      "pitch": 1,
      "os": [
        "Windows"
      ],
      "preloaded": true
    },
    {
      "label": "Danny",
      "name": "Microsoft Danny - Chinese (Traditional, Hong Kong S.A.R.)",
      "language": "cmn-HK",
      "altLanguage": "zh-HK",
      "gender": "male",
      "quality": [
        "normal"
      ],
      "rate": 1,
      "pitch": 1,
      "os": [
        "Windows"
      ],
      "preloaded": true
    },
    {
      "label": "女聲1",
      "name": "Android Speech Recognition and Synthesis from Google yue-hk-x-jar-network",
      "altNames": [
        "Chrome OS 粵語 1",
        "Android Speech Recognition and Synthesis from Google yue-HK-x-jar-local",
        "Android Speech Recognition and Synthesis from Google yue-HK-language"
      ],
      "nativeID": [
        "yue-hk-x-jar-network",
        "yue-hk-x-jar-local"
      ],
      "language": "yue-HK",
      "altLanguage": "zh-HK",
      "gender": "female",
      "quality": [
        "high"
      ],
      "rate": 1,
      "pitch": 1,
      "os": [
        "Android",
        "ChromeOS"
      ],
      "preloaded": true
    },
    {
      "label": "女聲2",
      "name": "Android Speech Recognition and Synthesis from Google yue-hk-x-yuc-network",
      "altNames": [
        "Chrome OS 粵語 2",
        "Android Speech Recognition and Synthesis from Google yue-HK-x-yuc-local"
      ],
      "nativeID": [
        "yue-hk-x-yuc-network",
        "yue-hk-x-yuc-local"
      ],
      "language": "yue-HK",
      "altLanguage": "zh-HK",
      "gender": "female",
      "quality": [
        "high"
      ],
      "rate": 1,
      "pitch": 1,
      "os": [
        "Android",
        "ChromeOS"
      ],
      "preloaded": true
    },
    {
      "label": "男聲1",
      "name": "Android Speech Recognition and Synthesis from Google yue-hk-x-yud-network",
      "altNames": [
        "Chrome OS 粵語 3",
        "Android Speech Recognition and Synthesis from Google yue-HK-x-yud-local"
      ],
      "nativeID": [
        "yue-hk-x-yud-network",
        "yue-hk-x-yud-local"
      ],
      "language": "yue-HK",
      "altLanguage": "zh-HK",
      "gender": "male",
      "quality": [
        "high"
      ],
      "rate": 1,
      "pitch": 1,
      "os": [
        "Android",
        "ChromeOS"
      ],
      "preloaded": true
    },
    {
      "label": "男聲2",
      "name": "Android Speech Recognition and Synthesis from Google yue-hk-x-yue-network",
      "altNames": [
        "Chrome OS 粵語 5",
        "Android Speech Recognition and Synthesis from Google yue-HK-x-yue-local"
      ],
      "nativeID": [
        "yue-hk-x-yue-network",
        "yue-hk-x-yue-local"
      ],
      "language": "yue-HK",
      "altLanguage": "zh-HK",
      "gender": "male",
      "quality": [
        "high"
      ],
      "rate": 1,
      "pitch": 1,
      "os": [
        "Android",
        "ChromeOS"
      ],
      "preloaded": true
    },
    {
      "label": "男聲3",
      "name": "Android Speech Recognition and Synthesis from Google yue-hk-x-yuf-network",
      "altNames": [
        "Chrome OS 粵語 5",
        "Android Speech Recognition and Synthesis from Google yue-HK-x-yuf-local"
      ],
      "nativeID": [
        "yue-hk-x-yuf-network",
        "yue-hk-x-yuf-local"
      ],
      "language": "yue-HK",
      "altLanguage": "zh-HK",
      "gender": "male",
      "quality": [
        "high"
      ],
      "rate": 1,
      "pitch": 1,
      "os": [
        "Android",
        "ChromeOS"
      ],
      "preloaded": true
    }
  ]
}
