{
  "language": "ca",
  "defaultRegion": "ca-ES",
  "testUtterance": "Hola, em dic {name} i sóc una veu catalana",
  "voices": [
    {
      "label": "Joana (Català)",
      "name": "Microsoft Joana Online (Natural) - Catalan",
      "language": "ca-ES",
      "otherLanguages": [
        "es"
      ],
      "gender": "female",
      "quality": [
        "veryHigh"
      ],
      "rate": 1,
      "browser": [
        "Edge"
      ],
      "preloaded": true,
      "controls": {
        "pitch": false,
        "boundary": false
      }
    },
    {
      "label": "Enric (Català)",
      "name": "Microsoft Enric Online (Natural) - Catalan",
      "language": "ca-ES",
      "otherLanguages": [
        "es"
      ],
      "gender": "male",
      "quality": [
        "veryHigh"
      ],
      "rate": 1,
      "browser": [
        "Edge"
      ],
      "preloaded": true,
      "controls": {
        "pitch": false,
        "boundary": false
      }
    },
    {
      "label": "Montse (Català)",
      "name": "Montse",
      "localizedName": "apple",
      "language": "ca-ES",
      "gender": "female",
      "quality": [
        "low",
        "normal"
      ],
      "rate": 1,
      "pitch": 1,
      "os": [
        "macOS",
        "iOS",
        "iPadOS"
      ],
      "preloaded": true
    },
    {
      "label": "Pau (Valencià)",
      "name": "Pau",
      "localizedName": "apple",
      "language": "ca-ES-u-sd-esvc",
      "gender": "female",
      "quality": [
        "low",
        "normal"
      ],
      "rate": 1,
      "pitch": 1,
      "os": [
        "macOS",
        "iOS",
        "iPadOS"
      ]
    },
    {
      "label": "Jordi (Català)",
      "name": "Jordi",
      "localizedName": "apple",
      "language": "ca-ES",
      "gender": "male",
      "quality": [
        "low",
        "normal"
      ],
      "rate": 1,
      "pitch": 1,
      "os": [
        "macOS",
        "iOS",
        "iPadOS"
      ]
    },
    {
      "label": "Herena (Català)",
      "name": "Microsoft Herena - Catalan (Spain)",
      "language": "ca-ES",
      "gender": "female",
      "quality": [
        "normal"
      ],
      "rate": 1,
      "pitch": 1,
      "os": [
        "Windows"
      ],
      "preloaded": true
    },
    {
      "label": "Veu femenina catalana",
      "name": "Android Speech Recognition and Synthesis from Google ca-es-x-caf-network",
      "altNames": [
        "Android Speech Recognition and Synthesis from Google ca-es-x-caf-local",
        "Android Speech Recognition and Synthesis from Google ca-ES-language"
      ],
      "nativeID": [
        "ca-es-x-caf-network",
        "ca-es-x-caf-local"
      ],
      "language": "ca-ES",
      "otherLanguages": [
        "es"
      ],
      "gender": "female",
      "quality": [
        "high"
      ],
      "rate": 1,
      "pitch": 1,
      "os": [
        "Android",
        "ChromeOS"
      ],
      "preloaded": true
    }
  ]
}
