{
  "language": "bg",
  "defaultRegion": "bg-BG",
  "testUtterance": "Здравейте, казвам се {name} и съм български глас.",
  "voices": [
    {
      "label": "Kalina",
      "name": "Microsoft Kalina Online (Natural) - Bulgarian (Bulgaria)",
      "language": "bg-BG",
      "gender": "female",
      "quality": [
        "veryHigh"
      ],
      "rate": 1,
      "browser": [
        "Edge"
      ],
      "preloaded": true,
      "controls": {
        "pitch": false,
        "boundary": false
      }
    },
    {
      "label": "Borislav",
      "name": "Microsoft Borislav Online (Natural) - Bulgarian (Bulgaria)",
      "language": "bg-BG",
      "gender": "male",
      "quality": [
        "veryHigh"
      ],
      "rate": 1,
      "browser": [
        "Edge"
      ],
      "preloaded": true,
      "controls": {
        "pitch": false,
        "boundary": false
      }
    },
    {
      "label": "Daria",
      "name": "Daria",
      "localizedName": "apple",
      "language": "bg-BG",
      "gender": "female",
      "quality": [
        "low",
        "normal"
      ],
      "rate": 1,
      "pitch": 1,
      "os": [
        "macOS",
        "iOS",
        "iPadOS"
      ],
      "preloaded": true
    },
    {
      "label": "Ivan",
      "name": "Microsoft Ivan - Bulgarian (Bulgaria)",
      "language": "bg-BG",
      "gender": "male",
      "quality": [
        "normal"
      ],
      "rate": 1,
      "pitch": 1,
      "os": [
        "Windows"
      ],
      "preloaded": true
    },
    {
      "label": "Женски глас",
      "name": "Android Speech Recognition and Synthesis from Google bg-bg-x-ifk-network",
      "altNames": [
        "Android Speech Recognition and Synthesis from Google bg-bg-x-ifk-local",
        "Android Speech Recognition and Synthesis from Google bg-bg-language"
      ],
      "nativeID": [
        "bg-bg-x-ifk-network",
        "bg-bg-x-ifk-local"
      ],
      "language": "bg-BG",
      "gender": "female",
      "quality": [
        "high"
      ],
      "rate": 1,
      "pitch": 1,
      "os": [
        "Android",
        "ChromeOS"
      ],
      "preloaded": true
    }
  ]
}
