{
  "language": "th",
  "defaultRegion": "th-TH",
  "testUtterance": "สวัสดีค่ะ ฉันชื่อ {name} และฉันเป็นคนมีเสียงภาษาไทย",
  "voices": [
    {
      "label": "Premwadee",
      "name": "Microsoft Premwadee Online (Natural) - Thai (Thailand)",
      "language": "th-TH",
      "gender": "female",
      "quality": [
        "veryHigh"
      ],
      "rate": 1,
      "browser": [
        "Edge"
      ],
      "preloaded": true,
      "controls": {
        "pitch": false,
        "boundary": false
      }
    },
    {
      "label": "Niwat",
      "name": "Microsoft Niwat Online (Natural) - Thai (Thailand)",
      "language": "th-TH",
      "gender": "male",
      "quality": [
        "veryHigh"
      ],
      "rate": 1,
      "browser": [
        "Edge"
      ],
      "preloaded": true,
      "controls": {
        "pitch": false,
        "boundary": false
      }
    },
    {
      "label": "Narisa",
      "name": "Narisa",
      "localizedName": "apple",
      "language": "th-TH",
      "gender": "female",
      "quality": [
        "low",
        "normal"
      ],
      "rate": 1,
      "pitch": 1,
      "os": [
        "macOS",
        "iOS",
        "iPadOS"
      ]
    },
    {
      "label": "Kanya",
      "name": "Kanya",
      "localizedName": "apple",
      "language": "th-TH",
      "gender": "female",
      "quality": [
        "low",
        "normal"
      ],
      "rate": 1,
      "pitch": 1,
      "os": [
        "macOS",
        "iOS",
        "iPadOS"
      ],
      "preloaded": true
    },
    {
      "label": "Pattara",
      "name": "Microsoft Pattara - Thai (Thailand)",
      "language": "th-TH",
      "gender": "male",
      "quality": [
        "normal"
      ],
      "rate": 1,
      "pitch": 1,
      "os": [
        "Windows"
      ],
      "preloaded": true
    },
    {
      "label": "เสียงผู้หญิง",
      "name": "Google ไทย (Natural)",
      "altNames": [
        "Android Speech Recognition and Synthesis from Google th-th-x-mol-network",
        "Chrome OS ไทย",
        "Android Speech Recognition and Synthesis from Google th-th-x-mol-local",
        "Android Speech Recognition and Synthesis from Google th-TH-language"
      ],
      "nativeID": [
        "th-th-x-mol-network",
        "th-th-x-mol-local"
      ],
      "language": "th-TH",
      "gender": "female",
      "quality": [
        "high"
      ],
      "rate": 1,
      "pitch": 1,
      "os": [
        "Android",
        "ChromeOS"
      ],
      "preloaded": true
    }
  ]
}
