{
  "language": "bn",
  "defaultRegion": "bn-IN",
  "testUtterance": "হ্যালো, আমার নাম {name} এবং আমি একজন বাংলা ভয়েস।",
  "voices": [
    {
      "label": "Tanishaa",
      "name": "Microsoft Tanishaa Online (Natural) - Bengali (India)",
      "language": "bn-IN",
      "gender": "female",
      "quality": [
        "veryHigh"
      ],
      "rate": 1,
      "browser": [
        "Edge"
      ],
      "preloaded": true,
      "controls": {
        "pitch": false,
        "boundary": false
      }
    },
    {
      "label": "Bashkar",
      "name": "Microsoft Bashkar Online (Natural) - Bangla (India)",
      "language": "bn-IN",
      "gender": "male",
      "quality": [
        "veryHigh"
      ],
      "rate": 1,
      "browser": [
        "Edge"
      ],
      "preloaded": true,
      "controls": {
        "pitch": false,
        "boundary": false
      }
    },
    {
      "label": "Nabanita",
      "name": "Microsoft Nabanita Online (Natural) - Bangla (Bangladesh)",
      "language": "bn-BD",
      "gender": "female",
      "quality": [
        "veryHigh"
      ],
      "rate": 1,
      "browser": [
        "Edge"
      ],
      "preloaded": true,
      "controls": {
        "pitch": false,
        "boundary": false
      }
    },
    {
      "label": "Pradeep",
      "name": "Microsoft Pradeep Online (Natural) - Bangla (Bangladesh)",
      "language": "bn-BD",
      "gender": "male",
      "quality": [
        "veryHigh"
      ],
      "rate": 1,
      "browser": [
        "Edge"
      ],
      "preloaded": true,
      "controls": {
        "pitch": false,
        "boundary": false
      }
    },
    {
      "label": "Piya",
      "name": "Piya",
      "localizedName": "apple",
      "language": "bn-IN",
      "gender": "female",
      "quality": [
        "low",
        "normal"
      ],
      "rate": 1,
      "pitch": 1,
      "os": [
        "macOS",
        "iOS",
        "iPadOS"
      ],
      "preloaded": true
    },
    {
      "label": "মহিলা কণ্ঠস্বর 1",
      "name": "Android Speech Recognition and Synthesis from Google bn-in-x-bnf-network",
      "altNames": [
        "Android Speech Recognition and Synthesis from Google bn-in-x-bnf-local",
        "Android Speech Recognition and Synthesis from Google bn-IN-language"
      ],
      "nativeID": [
        "bn-in-x-bnf-network",
        "bn-in-x-bnf-local"
      ],
      "language": "bn-IN",
      "gender": "female",
      "quality": [
        "high"
      ],
      "rate": 1,
      "pitch": 1,
      "os": [
        "Android",
        "ChromeOS"
      ],
      "preloaded": true,
      "controls": {
        "boundary": false
      }
    },
    {
      "label": "মহিলা কণ্ঠস্বর 2",
      "name": "Android Speech Recognition and Synthesis from Google bn-in-x-bnx-network",
      "altNames": [
        "Android Speech Recognition and Synthesis from Google bn-in-x-bnx-local"
      ],
      "nativeID": [
        "bn-in-x-bnx-network",
        "bn-in-x-bnx-local"
      ],
      "language": "bn-IN",
      "gender": "female",
      "quality": [
        "high"
      ],
      "rate": 1,
      "pitch": 1,
      "os": [
        "Android",
        "ChromeOS"
      ],
      "preloaded": true,
      "controls": {
        "boundary": false
      }
    },
    {
      "label": "পুরুষ কন্ঠ 1",
      "name": "Android Speech Recognition and Synthesis from Google bn-in-x-bin-network",
      "altNames": [
        "Android Speech Recognition and Synthesis from Google bn-in-x-bin-local"
      ],
      "nativeID": [
        "bn-in-x-bin-network",
        "bn-in-x-bin-local"
      ],
      "language": "bn-IN",
      "gender": "male",
      "quality": [
        "high"
      ],
      "rate": 1,
      "pitch": 1,
      "os": [
        "Android",
        "ChromeOS"
      ],
      "preloaded": true,
      "controls": {
        "boundary": false
      }
    },
    {
      "label": "পুরুষ কন্ঠ 2",
      "name": "Android Speech Recognition and Synthesis from Google bn-in-x-bnm-network",
      "altNames": [
        "Android Speech Recognition and Synthesis from Google bn-in-x-bnm-local"
      ],
      "nativeID": [
        "bn-in-x-bnm-network",
        "bn-in-x-bnm-local"
      ],
      "language": "bn-IN",
      "gender": "male",
      "quality": [
        "high"
      ],
      "rate": 1,
      "pitch": 1,
      "os": [
        "Android",
        "ChromeOS"
      ],
      "preloaded": true,
      "controls": {
        "boundary": false
      }
    },
    {
      "label": "পুরুষ কন্ঠ",
      "name": "Google বাংলা (Natural)",
      "altNames": [
        "Android Speech Recognition and Synthesis from Google bn-bd-x-ban-network",
        "Chrome OS বাংলা",
        "Android Speech Recognition and Synthesis from Google bn-bd-x-ban-local",
        "Android Speech Recognition and Synthesis from Google bn-BD-language"
      ],
      "nativeID": [
        "bn-bd-x-ban-network",
        "bn-bd-x-ban-local"
      ],
      "language": "bn-BD",
      "gender": "male",
      "quality": [
        "high"
      ],
      "rate": 1,
      "pitch": 1,
      "os": [
        "Android",
        "ChromeOS"
      ],
      "preloaded": true,
      "controls": {
        "boundary": false
      }
    }
  ]
}
