{
  "language": "cs",
  "defaultRegion": "cs-CZ",
  "testUtterance": "Dobrý den, jmenuji se {name} a jsem český hlas.",
  "voices": [
    {
      "label": "Vlasta",
      "name": "Microsoft Vlasta Online (Natural) - Czech (Czech)",
      "language": "cs-CZ",
      "gender": "female",
      "quality": [
        "veryHigh"
      ],
      "rate": 1,
      "browser": [
        "Edge"
      ],
      "preloaded": true,
      "controls": {
        "pitch": false,
        "boundary": false
      }
    },
    {
      "label": "Antonin",
      "name": "Microsoft Antonin Online (Natural) - Czech (Czech)",
      "language": "cs-CZ",
      "gender": "male",
      "quality": [
        "veryHigh"
      ],
      "rate": 1,
      "browser": [
        "Edge"
      ],
      "preloaded": true,
      "controls": {
        "pitch": false,
        "boundary": false
      }
    },
    {
      "label": "Zuzana",
      "name": "Zuzana",
      "localizedName": "apple",
      "language": "cs-CZ",
      "gender": "female",
      "quality": [
        "low",
        "normal",
        "high"
      ],
      "rate": 1,
      "pitch": 1,
      "os": [
        "macOS",
        "iOS",
        "iPadOS"
      ],
      "preloaded": true
    },
    {
      "label": "Iveta",
      "name": "Iveta",
      "localizedName": "apple",
      "language": "cs-CZ",
      "gender": "female",
      "quality": [
        "low",
        "normal"
      ],
      "rate": 1,
      "pitch": 1,
      "os": [
        "macOS",
        "iOS",
        "iPadOS"
      ]
    },
    {
      "label": "Jakub",
      "name": "Microsoft Jakub - Czech (Czech)",
      "language": "cs-CZ",
      "gender": "male",
      "quality": [
        "normal"
      ],
      "rate": 1,
      "pitch": 1,
      "os": [
        "Windows"
      ],
      "preloaded": true
    },
    {
      "label": "Ženský hlas",
      "name": "Google čeština (Natural)",
      "altNames": [
        "Android Speech Recognition and Synthesis from Google cs-cz-x-jfs-network",
        "Chrome OS čeština",
        "Android Speech Recognition and Synthesis from Google cs-cz-x-jfs-local",
        "Android Speech Recognition and Synthesis from Google cs-CZ-language"
      ],
      "nativeID": [
        "cs-cz-x-jfs-network",
        "cs-cz-x-jfs-local"
      ],
      "language": "cs-CZ",
      "gender": "female",
      "quality": [
        "high"
      ],
      "rate": 1,
      "pitch": 1,
      "os": [
        "Android",
        "ChromeOS"
      ],
      "preloaded": true
    }
  ]
}
