{
  "language": "kk",
  "defaultRegion": "kk-KZ",
  "testUtterance": "Сәлеметсіз бе, менің атым {name} және мен қазақ дауыстымын.",
  "voices": [
    {
      "label": "Aigul",
      "name": "Microsoft Aigul Online (Natural) - Kazakh (Kazakhstan)",
      "language": "kk-KZ",
      "gender": "female",
      "quality": [
        "veryHigh"
      ],
      "rate": 1,
      "browser": [
        "Edge"
      ],
      "preloaded": true,
      "controls": {
        "pitch": false,
        "boundary": false
      }
    },
    {
      "label": "Daulet",
      "name": "Microsoft Daulet Online (Natural) - Kazakh (Kazakhstan)",
      "language": "kk-KZ",
      "gender": "male",
      "quality": [
        "veryHigh"
      ],
      "rate": 1,
      "browser": [
        "Edge"
      ],
      "preloaded": true,
      "controls": {
        "pitch": false,
        "boundary": false
      }
    },
    {
      "label": "Aru",
      "name": "Aru",
      "nativeID": [
        "com.apple.voice.Aru"
      ],
      "localizedName": "apple",
      "language": "kk-KZ",
      "gender": "female",
      "quality": [
        "normal"
      ],
      "rate": 1,
      "pitch": 1,
      "os": [
        "macOS",
        "iOS",
        "iPadOS"
      ]
    }
  ]
}
