{
  "language": "te",
  "defaultRegion": "te-IN",
  "testUtterance": "హలో, నా పేరు {name} మరియు నేను తెలుగు వాణిని.",
  "voices": [
    {
      "label": "Shruti",
      "name": "Microsoft Shruti Online (Natural) - Telugu (India)",
      "language": "te-IN",
      "gender": "female",
      "quality": [
        "veryHigh"
      ],
      "rate": 1,
      "browser": [
        "Edge"
      ],
      "preloaded": true,
      "controls": {
        "pitch": false,
        "boundary": false
      }
    },
    {
      "label": "Mohan",
      "name": "Microsoft Mohan Online (Natural) - Telugu (India)",
      "language": "te-IN",
      "gender": "male",
      "quality": [
        "veryHigh"
      ],
      "rate": 1,
      "browser": [
        "Edge"
      ],
      "preloaded": true,
      "controls": {
        "pitch": false,
        "boundary": false
      }
    },
    {
      "label": "Geeta",
      "name": "Geeta",
      "localizedName": "apple",
      "language": "te-IN",
      "gender": "female",
      "quality": [
        "low",
        "normal"
      ],
      "rate": 1,
      "pitch": 1,
      "os": [
        "macOS",
        "iOS",
        "iPadOS"
      ],
      "preloaded": true
    },
    {
      "label": "స్త్రీ స్వరం",
      "name": "Android Speech Recognition and Synthesis from Google te-in-x-tef-network",
      "altNames": [
        "Android Speech Recognition and Synthesis from Google te-in-x-tef-local",
        "Android Speech Recognition and Synthesis from Google te-IN-language"
      ],
      "nativeID": [
        "te-in-x-tef-network",
        "te-in-x-tef-local"
      ],
      "language": "te-IN",
      "gender": "female",
      "quality": [
        "high"
      ],
      "rate": 1,
      "pitch": 1,
      "os": [
        "Android",
        "ChromeOS"
      ],
      "preloaded": true,
      "controls": {
        "boundary": false
      }
    },
    {
      "label": "పురుష స్వరం",
      "name": "Android Speech Recognition and Synthesis from Google te-in-x-tem-network",
      "altNames": [
        "Android Speech Recognition and Synthesis from Google te-in-x-tem-local"
      ],
      "nativeID": [
        "te-in-x-tem-network",
        "te-in-x-tem-local"
      ],
      "language": "te-IN",
      "gender": "male",
      "quality": [
        "high"
      ],
      "rate": 1,
      "pitch": 1,
      "os": [
        "Android",
        "ChromeOS"
      ],
      "preloaded": true,
      "controls": {
        "boundary": false
      }
    }
  ]
}
