{
  "language": "gl",
  "defaultRegion": "gl-ES",
  "testUtterance": "Ola, chámome {name} e son unha voz galega.",
  "voices": [
    {
      "label": "Sabela",
      "name": "Microsoft Sabela Online (Natural) - Galician",
      "language": "gl-ES",
      "gender": "female",
      "quality": [
        "veryHigh"
      ],
      "rate": 1,
      "browser": [
        "Edge"
      ],
      "preloaded": true,
      "controls": {
        "pitch": false,
        "boundary": false
      }
    },
    {
      "label": "Roi",
      "name": "Microsoft Roi Online (Natural) - Galician",
      "language": "gl-ES",
      "gender": "male",
      "quality": [
        "veryHigh"
      ],
      "rate": 1,
      "browser": [
        "Edge"
      ],
      "preloaded": true,
      "controls": {
        "pitch": false,
        "boundary": false
      }
    },
    {
      "label": "Carmela",
      "name": "Carmela",
      "localizedName": "apple",
      "language": "gl-ES",
      "gender": "female",
      "quality": [
        "low",
        "normal"
      ],
      "rate": 1,
      "pitch": 1,
      "os": [
        "macOS",
        "iOS",
        "iPadOS"
      ]
    }
  ]
}
