{
  "language": "kn",
  "defaultRegion": "kn-IN",
  "testUtterance": "ಹಲೋ, ನನ್ನ ಹೆಸರು {name} ಮತ್ತು ನಾನು ಕನ್ನಡ ಧ್ವನಿ.",
  "voices": [
    {
      "label": "Sapna",
      "name": "Microsoft Sapna Online (Natural) - Kannada (India)",
      "language": "kn-IN",
      "gender": "female",
      "quality": [
        "veryHigh"
      ],
      "rate": 1,
      "browser": [
        "Edge"
      ],
      "preloaded": true,
      "controls": {
        "pitch": false,
        "boundary": false
      }
    },
    {
      "label": "Gagan",
      "name": "Microsoft Gagan Online (Natural) - Kannada (India)",
      "language": "kn-IN",
      "gender": "male",
      "quality": [
        "veryHigh"
      ],
      "rate": 1,
      "browser": [
        "Edge"
      ],
      "preloaded": true,
      "controls": {
        "pitch": false,
        "boundary": false
      }
    },
    {
      "label": "Soumya",
      "name": "Soumya",
      "localizedName": "apple",
      "language": "kn-IN",
      "gender": "female",
      "quality": [
        "low",
        "normal"
      ],
      "rate": 1,
      "pitch": 1,
      "os": [
        "macOS",
        "iOS",
        "iPadOS"
      ],
      "preloaded": true
    },
    {
      "label": "ಸ್ತ್ರೀ ಧ್ವನಿ",
      "name": "Android Speech Recognition and Synthesis from Google kn-in-x-knf-network",
      "altNames": [
        "Android Speech Recognition and Synthesis from Google kn-in-x-knf-local",
        "Android Speech Recognition and Synthesis from Google kn-IN-language"
      ],
      "nativeID": [
        "kn-in-x-knf-network",
        "kn-in-x-knf-local"
      ],
      "language": "kn-IN",
      "gender": "female",
      "quality": [
        "high"
      ],
      "rate": 1,
      "pitch": 1,
      "os": [
        "Android",
        "ChromeOS"
      ],
      "preloaded": true,
      "controls": {
        "boundary": false
      }
    },
    {
      "label": "ಪುರುಷ ಧ್ವನಿ",
      "name": "Android Speech Recognition and Synthesis from Google kn-in-x-knm-network",
      "altNames": [
        "Android Speech Recognition and Synthesis from Google kn-in-x-knm-local"
      ],
      "nativeID": [
        "kn-in-x-knm-network",
        "kn-in-x-knm-local"
      ],
      "language": "kn-IN",
      "gender": "male",
      "quality": [
        "high"
      ],
      "rate": 1,
      "pitch": 1,
      "os": [
        "Android",
        "ChromeOS"
      ],
      "preloaded": true,
      "controls": {
        "boundary": false
      }
    }
  ]
}
